{
  "schemaVersion": "1.0",
  "id": "dry-run.translation.variant",
  "description": "Second dry-run scenario to validate comparison output and multi-scenario flow.",
  "mode": "dry-run",
  "fixture": {
    "inputPath": "harness/fixtures/input.variant.json",
    "expectedOutputPath": "harness/fixtures/output.variant.json"
  },
  "schemaVersion": "1.0"
}
